{
  "schema_version": "1",
  "benchmark_name": "b0-harness-calibration",
  "matrix_id": "B0",
  "git_commit": "7666a795f196c8cdafc3896636e60bfeeb286a01",
  "git_dirty": false,
  "go_version": "go1.26.7",
  "host": {
    "os": "windows",
    "arch": "amd64",
    "hostname": "Jay",
    "cpus": 8
  },
  "started_at": "2026-08-31T01:47:25.4239705Z",
  "finished_at": "2026-08-31T02:30:55.7694959Z",
  "configuration": {
    "schema_version": "1",
    "name": "b0-harness-calibration",
    "matrix_id": "B0",
    "clients": 50,
    "commands": 5000,
    "payload_bytes": 64,
    "warmup_commands": 100,
    "trials": 5,
    "submit_concurrency": 32,
    "priority": 4,
    "expires_after_seconds": 3600,
    "control_address": "127.0.0.1:50051",
    "gateway_address": "127.0.0.1:50052",
    "producer_id": "bench-producer",
    "gateway_id": "gateway-bench",
    "poll_interval_ms": 25,
    "trial_timeout_seconds": 900
  },
  "trials": [
    {
      "trial": 1,
      "commands_submitted": 5000,
      "commands_acknowledged": 5000,
      "duration_seconds": 460.2825421,
      "throughput_ack_per_second": 10.862892990005497,
      "latency_seconds": {
        "p50": 232.4135794,
        "p95": 439.744655905,
        "p99": 457.1971161,
        "max": 460.4909322
      }
    },
    {
      "trial": 2,
      "commands_submitted": 5000,
      "commands_acknowledged": 5000,
      "duration_seconds": 373.1518774,
      "throughput_ack_per_second": 13.399369808450011,
      "latency_seconds": {
        "p50": 218.98493159999998,
        "p95": 362.76084874000003,
        "p99": 372.578653837,
        "max": 373.3605593
      }
    },
    {
      "trial": 3,
      "commands_submitted": 5000,
      "commands_acknowledged": 5000,
      "duration_seconds": 432.2526896,
      "throughput_ack_per_second": 11.567308012882288,
      "latency_seconds": {
        "p50": 255.08675635,
        "p95": 420.23686146500006,
        "p99": 431.45914135299995,
        "max": 432.4129302
      }
    },
    {
      "trial": 4,
      "commands_submitted": 5000,
      "commands_acknowledged": 5000,
      "duration_seconds": 577.4288078,
      "throughput_ack_per_second": 8.659076118924457,
      "latency_seconds": {
        "p50": 348.09112315000004,
        "p95": 562.793777495,
        "p99": 576.345016347,
        "max": 577.5807552
      }
    },
    {
      "trial": 5,
      "commands_submitted": 5000,
      "commands_acknowledged": 5000,
      "duration_seconds": 644.6519418,
      "throughput_ack_per_second": 7.756123383478808,
      "latency_seconds": {
        "p50": 407.6031818,
        "p95": 634.152549995,
        "p99": 644.1902416160001,
        "max": 644.9331828
      }
    }
  ],
  "aggregate": {
    "throughput_ack_per_second": {
      "median": 10.862892990005497,
      "min": 7.756123383478808,
      "max": 13.399369808450011
    },
    "latency_seconds": {
      "p50": {
        "median": 255.08675635,
        "min": 218.98493159999998,
        "max": 407.6031818
      },
      "p95": {
        "median": 439.744655905,
        "min": 362.76084874000003,
        "max": 634.152549995
      },
      "p99": {
        "median": 457.1971161,
        "min": 372.578653837,
        "max": 644.1902416160001
      }
    }
  },
  "bottleneck_notes": "First bottleneck is typically PostgreSQL commit latency on submit and acknowledge paths under concurrent device load; gateway and client CPU remain secondary until admission limits or scheduler batch size saturate."
}
